{
  "commit_sha": "746e90b56d3150d96acbff4a0f02308ab151669c",
  "decision": "REQUEST_CHANGES",
  "findings": [
    {
      "assessment": "confirmed",
      "category": "correctness",
      "evidence": "The guard condition was changed from `if denominator == 0` to `if numerator == 0`. This removes the ZeroDivisionError protection. `ratio(5, 0)` will now crash with `ZeroDivisionError` instead of returning `0.0`. The new condition `if numerator == 0` is redundant because `0 / denominator` already equals `0.0` for any non-zero denominator.",
      "file": "calculator.py",
      "line": 2,
      "recommendation": "Revert the condition back to `if denominator == 0:` to preserve the division-by-zero guard.",
      "severity": "critical"
    }
  ],
  "summary": "The change in `calculator.py` replaces the zero-denominator guard (`if denominator == 0`) with a zero-numerator check (`if numerator == 0`). This introduces a division-by-zero bug: calls like `ratio(5, 0)` will now raise a `ZeroDivisionError` instead of returning `0.0`. Meanwhile, the new guard `if numerator == 0` is functionally unnecessary since `0 / denominator` already yields `0.0` for any non-zero denominator.",
  "tests": {
    "commands": [
      "python -m unittest test_calculator.py"
    ],
    "passed": false
  },
  "uncertainties": []
}
